{
  "$schema": "https://json-schema.org/draft/2020-12/schema",
  "$id": "https://github.com/RoninForge/ai-price-index/schema/price-record.schema.json",
  "title": "AI Price Index price record",
  "description": "One dated, first-party-sourced price assertion. This is the human-facing / contribution form. On ingestion the system of record adds the bitemporal bookkeeping fields (record_id, recorded_at, superseded_at, supersedes_id, change_reason, recorded_by); contributors and examples never set those.",
  "type": "object",
  "additionalProperties": false,
  "required": [
    "provider",
    "model_id",
    "variation",
    "unit",
    "price_usd",
    "effective_from",
    "last_validated_at",
    "source_url",
    "source_kind",
    "confidence"
  ],
  "properties": {
    "provider": {
      "type": "string",
      "pattern": "^[a-z0-9]+(?:-[a-z0-9]+)*$",
      "description": "Canonical provider slug, e.g. 'anthropic', 'openai', 'google'."
    },
    "model_id": {
      "type": "string",
      "minLength": 1,
      "description": "Canonical model id, preferably the dated snapshot id, e.g. 'claude-opus-4-5-20251101'."
    },
    "variation": {
      "type": "string",
      "enum": [
        "input",
        "output",
        "cache_read",
        "cache_write",
        "cache_write_5m",
        "cache_write_1h",
        "batch_input",
        "batch_output",
        "tier2_input",
        "tier2_output",
        "tier2_cache_read",
        "tier2_cache_write",
        "tier2_cache_write_5m",
        "tier2_cache_write_1h",
        "embeddings",
        "audio_per_min",
        "image_per_item"
      ]
    },
    "unit": {
      "type": "string",
      "enum": [
        "usd_per_mtok",
        "usd_per_ktok",
        "usd_per_image",
        "usd_per_min",
        "usd_per_character",
        "usd_per_request"
      ]
    },
    "price_usd": {
      "type": "number",
      "minimum": 0,
      "maximum": 100000,
      "description": "Price in USD for one unit. A garbage filter only; real bounds are per provider."
    },
    "effective_from": {
      "type": "string",
      "format": "date",
      "pattern": "^\\d{4}-\\d{2}-\\d{2}$",
      "description": "Valid-time start (inclusive): the date this price took effect in the real world."
    },
    "effective_to": {
      "type": [
        "string",
        "null"
      ],
      "pattern": "^\\d{4}-\\d{2}-\\d{2}$",
      "description": "Valid-time end (exclusive); null means still current."
    },
    "last_validated_at": {
      "type": "string",
      "format": "date",
      "pattern": "^\\d{4}-\\d{2}-\\d{2}$",
      "description": "When this price was last CONFIRMED against its source. For a backfilled record, the evidence date (a Wayback capture date). Required on every record, including historical ones."
    },
    "source_url": {
      "type": "string",
      "format": "uri",
      "pattern": "^https?://",
      "description": "First-party provider pricing page, or an archive link for a backfilled record."
    },
    "source_kind": {
      "type": "string",
      "enum": [
        "provider_live",
        "wayback",
        "changelog",
        "aggregator",
        "manual"
      ]
    },
    "source_snapshot_ts": {
      "type": "string",
      "pattern": "^\\d{8,14}$",
      "description": "Wayback capture stamp, e.g. '20250427064348'. Omit for live records."
    },
    "confidence": {
      "type": "string",
      "enum": [
        "verified",
        "archived",
        "inferred",
        "estimated"
      ],
      "description": "verified = confirmed against the live first-party page; archived = a dated archive capture; inferred = derived from a changelog/announcement; estimated = best effort, clearly labelled."
    },
    "notes": {
      "type": "string",
      "description": "Optional human note (a caveat, a tier condition)."
    },
    "aliases": {
      "type": "array",
      "items": {
        "type": "string",
        "minLength": 1
      },
      "uniqueItems": true,
      "description": "Optional alternate model ids that resolve to this canonical model_id (e.g. an undated short form Claude Code emits). Series metadata only; does not alter pricing."
    },
    "announced_change": {
      "type": "object",
      "description": "Optional: a dated price change the vendor has PUBLISHED but which is not yet in effect. It rides alongside the current price and never replaces it, so a consumer reading price_usd still gets what the model costs today. Only valid on the open record (effective_to null), and validation FAILS once effective_from arrives, which forces the real change to be recorded rather than letting the announcement rot.",
      "required": [
        "price_usd",
        "effective_from",
        "source_url",
        "quote"
      ],
      "additionalProperties": false,
      "properties": {
        "price_usd": {
          "type": "number",
          "minimum": 0,
          "maximum": 100000,
          "description": "The announced future price in USD for one unit, in the same `unit` as the record."
        },
        "effective_from": {
          "type": "string",
          "format": "date",
          "pattern": "^\\d{4}-\\d{2}-\\d{2}$",
          "description": "The date the vendor says the new price starts. Must be in the future when written."
        },
        "source_url": {
          "type": "string",
          "format": "uri",
          "pattern": "^https?://",
          "description": "First-party page or change log stating the change."
        },
        "quote": {
          "type": "string",
          "minLength": 1,
          "description": "The vendor's own wording that states the change, verbatim, so the claim is checkable."
        },
        "notes": {
          "type": "string",
          "description": "Optional caveat (e.g. the announced price is stated as a rule rather than a number)."
        }
      }
    }
  }
}
