[
  {
    "provider": "cohere",
    "model_id": "command-a-plus",
    "variation": "input",
    "unit": "usd_per_mtok",
    "price_usd": 2.5,
    "effective_from": "2026-05-20",
    "effective_to": null,
    "last_validated_at": "2026-06-17",
    "source_url": "https://docs.cohere.com/docs/command-a",
    "source_kind": "provider_live",
    "confidence": "verified",
    "notes": "Hosted API price for command-a-plus-05-2026 (current flagship). Open weights are also self-hostable free."
  },
  {
    "provider": "cohere",
    "model_id": "command-a-plus",
    "variation": "output",
    "unit": "usd_per_mtok",
    "price_usd": 10,
    "effective_from": "2026-05-20",
    "effective_to": null,
    "last_validated_at": "2026-06-17",
    "source_url": "https://docs.cohere.com/docs/command-a",
    "source_kind": "provider_live",
    "confidence": "verified"
  },
  {
    "provider": "cohere",
    "model_id": "command-r-plus",
    "variation": "input",
    "unit": "usd_per_mtok",
    "price_usd": 2.5,
    "effective_from": "2024-08-30",
    "effective_to": null,
    "last_validated_at": "2026-06-17",
    "source_url": "https://docs.cohere.com/docs/command-r-plus",
    "source_kind": "provider_live",
    "confidence": "verified",
    "notes": "command-r-plus-08-2024."
  },
  {
    "provider": "cohere",
    "model_id": "command-r-plus",
    "variation": "output",
    "unit": "usd_per_mtok",
    "price_usd": 10,
    "effective_from": "2024-08-30",
    "effective_to": null,
    "last_validated_at": "2026-06-17",
    "source_url": "https://docs.cohere.com/docs/command-r-plus",
    "source_kind": "provider_live",
    "confidence": "verified"
  },
  {
    "provider": "cohere",
    "model_id": "command-r",
    "variation": "input",
    "unit": "usd_per_mtok",
    "price_usd": 0.15,
    "effective_from": "2024-08-30",
    "effective_to": null,
    "last_validated_at": "2026-06-17",
    "source_url": "https://cohere.com/pricing",
    "source_kind": "provider_live",
    "confidence": "verified",
    "notes": "command-r-08-2024."
  },
  {
    "provider": "cohere",
    "model_id": "command-r",
    "variation": "output",
    "unit": "usd_per_mtok",
    "price_usd": 0.6,
    "effective_from": "2024-08-30",
    "effective_to": null,
    "last_validated_at": "2026-06-17",
    "source_url": "https://cohere.com/pricing",
    "source_kind": "provider_live",
    "confidence": "verified"
  },
  {
    "provider": "cohere",
    "model_id": "command-r7b",
    "variation": "input",
    "unit": "usd_per_mtok",
    "price_usd": 0.0375,
    "effective_from": "2024-12-13",
    "effective_to": null,
    "last_validated_at": "2026-06-17",
    "source_url": "https://cohere.com/pricing",
    "source_kind": "provider_live",
    "confidence": "verified",
    "notes": "command-r7b-12-2024."
  },
  {
    "provider": "cohere",
    "model_id": "command-r7b",
    "variation": "output",
    "unit": "usd_per_mtok",
    "price_usd": 0.15,
    "effective_from": "2024-12-13",
    "effective_to": null,
    "last_validated_at": "2026-06-17",
    "source_url": "https://cohere.com/pricing",
    "source_kind": "provider_live",
    "confidence": "verified"
  }
]
