[
  {
    "provider": "ai21",
    "model_id": "jamba-large",
    "variation": "input",
    "unit": "usd_per_mtok",
    "price_usd": 2,
    "effective_from": "2025-07-03",
    "effective_to": null,
    "last_validated_at": "2026-06-17",
    "source_url": "https://www.ai21.com/pricing/",
    "source_kind": "provider_live",
    "confidence": "verified",
    "notes": "jamba-large-1.7-2025-07."
  },
  {
    "provider": "ai21",
    "model_id": "jamba-large",
    "variation": "output",
    "unit": "usd_per_mtok",
    "price_usd": 8,
    "effective_from": "2025-07-03",
    "effective_to": null,
    "last_validated_at": "2026-06-17",
    "source_url": "https://www.ai21.com/pricing/",
    "source_kind": "provider_live",
    "confidence": "verified"
  },
  {
    "provider": "ai21",
    "model_id": "jamba-mini",
    "variation": "input",
    "unit": "usd_per_mtok",
    "price_usd": 0.2,
    "effective_from": "2026-01-01",
    "effective_to": "2026-09-24",
    "last_validated_at": "2026-06-17",
    "source_url": "https://www.ai21.com/pricing/",
    "source_kind": "provider_live",
    "confidence": "inferred",
    "notes": "jamba-mini-2-2026-01; price verified, exact release day not first-party-stated (Jan 2026)."
  },
  {
    "provider": "ai21",
    "model_id": "jamba-mini",
    "variation": "output",
    "unit": "usd_per_mtok",
    "price_usd": 0.4,
    "effective_from": "2026-01-01",
    "effective_to": "2026-09-24",
    "last_validated_at": "2026-06-17",
    "source_url": "https://www.ai21.com/pricing/",
    "source_kind": "provider_live",
    "confidence": "inferred"
  },
  {
    "provider": "ai21",
    "model_id": "jamba-mini",
    "variation": "input",
    "unit": "usd_per_mtok",
    "price_usd": 0.2,
    "effective_from": "2026-09-24",
    "effective_to": null,
    "last_validated_at": "2026-09-24",
    "source_url": "https://www.ai21.com/pricing/",
    "source_kind": "provider_live",
    "confidence": "verified",
    "notes": "[provenance upgrade] first-party collector confirmed the published price; supersedes the prior inferred/provider_live record."
  },
  {
    "provider": "ai21",
    "model_id": "jamba-mini",
    "variation": "output",
    "unit": "usd_per_mtok",
    "price_usd": 0.4,
    "effective_from": "2026-09-24",
    "effective_to": null,
    "last_validated_at": "2026-09-24",
    "source_url": "https://www.ai21.com/pricing/",
    "source_kind": "provider_live",
    "confidence": "verified",
    "notes": "[provenance upgrade] first-party collector confirmed the published price; supersedes the prior inferred/provider_live record."
  }
]
