[
  {
    "provider": "meta-llama",
    "model_id": "llama-4-scout",
    "variation": "input",
    "unit": "usd_per_mtok",
    "price_usd": 0.18,
    "effective_from": "2025-04-05",
    "effective_to": null,
    "last_validated_at": "2026-06-22",
    "source_url": "https://www.together.ai/models/llama-4-scout",
    "source_kind": "aggregator",
    "confidence": "inferred",
    "notes": "[needs_review] cross-check flagged: input $0.18 is 1.8x OpenRouter's $0.1 - suspicious (reseller price should be >= first-party; expected ratio in [0.5, 1.5]); output $0.59 is 1.97x OpenRouter's $0.3 - suspicious (reseller price should be >= first-party; expected ratio in [0.5, 1.5]). No first-party Meta price; Together AI reference host."
  },
  {
    "provider": "meta-llama",
    "model_id": "llama-4-scout",
    "variation": "output",
    "unit": "usd_per_mtok",
    "price_usd": 0.59,
    "effective_from": "2025-04-05",
    "effective_to": null,
    "last_validated_at": "2026-06-22",
    "source_url": "https://www.together.ai/models/llama-4-scout",
    "source_kind": "aggregator",
    "confidence": "inferred",
    "notes": "[needs_review] cross-check flagged: input $0.18 is 1.8x OpenRouter's $0.1 - suspicious (reseller price should be >= first-party; expected ratio in [0.5, 1.5]); output $0.59 is 1.97x OpenRouter's $0.3 - suspicious (reseller price should be >= first-party; expected ratio in [0.5, 1.5]). No first-party Meta price; Together AI reference host."
  },
  {
    "provider": "meta-llama",
    "model_id": "llama-4-maverick",
    "variation": "input",
    "unit": "usd_per_mtok",
    "price_usd": 0.27,
    "effective_from": "2025-04-05",
    "effective_to": null,
    "last_validated_at": "2026-06-22",
    "source_url": "https://www.together.ai/models/llama-4-maverick",
    "source_kind": "aggregator",
    "confidence": "inferred",
    "notes": "[needs_review] cross-check flagged: input $0.27 is 1.8x OpenRouter's $0.15 - suspicious (reseller price should be >= first-party; expected ratio in [0.5, 1.5]). No first-party Meta price; Together AI reference host."
  },
  {
    "provider": "meta-llama",
    "model_id": "llama-4-maverick",
    "variation": "output",
    "unit": "usd_per_mtok",
    "price_usd": 0.85,
    "effective_from": "2025-04-05",
    "effective_to": null,
    "last_validated_at": "2026-06-22",
    "source_url": "https://www.together.ai/models/llama-4-maverick",
    "source_kind": "aggregator",
    "confidence": "inferred",
    "notes": "[needs_review] cross-check flagged: input $0.27 is 1.8x OpenRouter's $0.15 - suspicious (reseller price should be >= first-party; expected ratio in [0.5, 1.5]). No first-party Meta price; Together AI reference host."
  },
  {
    "provider": "meta-llama",
    "model_id": "llama-3.3-70b",
    "variation": "input",
    "unit": "usd_per_mtok",
    "price_usd": 1.04,
    "effective_from": "2026-06-22",
    "effective_to": null,
    "last_validated_at": "2026-06-22",
    "source_url": "https://www.together.ai/models/llama-3-3-70b",
    "source_kind": "aggregator",
    "confidence": "inferred",
    "notes": "[needs_review] cross-check flagged: no independent corroboration (new model, no OpenRouter match). No first-party Meta price; Together AI reference host."
  },
  {
    "provider": "meta-llama",
    "model_id": "llama-3.3-70b",
    "variation": "output",
    "unit": "usd_per_mtok",
    "price_usd": 1.04,
    "effective_from": "2026-06-22",
    "effective_to": null,
    "last_validated_at": "2026-06-22",
    "source_url": "https://www.together.ai/models/llama-3-3-70b",
    "source_kind": "aggregator",
    "confidence": "inferred",
    "notes": "[needs_review] cross-check flagged: no independent corroboration (new model, no OpenRouter match). No first-party Meta price; Together AI reference host."
  },
  {
    "provider": "meta-llama",
    "model_id": "llama-3.1-405b",
    "variation": "input",
    "unit": "usd_per_mtok",
    "price_usd": 3.5,
    "effective_from": "2026-06-22",
    "effective_to": null,
    "last_validated_at": "2026-06-22",
    "source_url": "https://www.together.ai/pricing",
    "source_kind": "aggregator",
    "confidence": "inferred",
    "notes": "[needs_review] cross-check flagged: no independent corroboration (new model, no OpenRouter match). No first-party Meta price; Together AI reference host."
  },
  {
    "provider": "meta-llama",
    "model_id": "llama-3.1-405b",
    "variation": "output",
    "unit": "usd_per_mtok",
    "price_usd": 3.5,
    "effective_from": "2026-06-22",
    "effective_to": null,
    "last_validated_at": "2026-06-22",
    "source_url": "https://www.together.ai/pricing",
    "source_kind": "aggregator",
    "confidence": "inferred",
    "notes": "[needs_review] cross-check flagged: no independent corroboration (new model, no OpenRouter match). No first-party Meta price; Together AI reference host."
  },
  {
    "provider": "meta-llama",
    "model_id": "llama-3.1-8b",
    "variation": "input",
    "unit": "usd_per_mtok",
    "price_usd": 0.18,
    "effective_from": "2026-06-22",
    "effective_to": null,
    "last_validated_at": "2026-06-22",
    "source_url": "https://www.together.ai/models/llama-3-1-8b-instruct-turbo",
    "source_kind": "aggregator",
    "confidence": "inferred",
    "notes": "[needs_review] cross-check flagged: no independent corroboration (new model, no OpenRouter match). No first-party Meta price; Together AI reference host."
  },
  {
    "provider": "meta-llama",
    "model_id": "llama-3.1-8b",
    "variation": "output",
    "unit": "usd_per_mtok",
    "price_usd": 0.18,
    "effective_from": "2026-06-22",
    "effective_to": null,
    "last_validated_at": "2026-06-22",
    "source_url": "https://www.together.ai/models/llama-3-1-8b-instruct-turbo",
    "source_kind": "aggregator",
    "confidence": "inferred",
    "notes": "[needs_review] cross-check flagged: no independent corroboration (new model, no OpenRouter match). No first-party Meta price; Together AI reference host."
  }
]
