[
  {
    "provider": "amazon",
    "model_id": "nova-micro",
    "variation": "input",
    "unit": "usd_per_mtok",
    "price_usd": 0.035,
    "effective_from": "2024-12-03",
    "effective_to": null,
    "last_validated_at": "2026-06-17",
    "source_url": "https://aws.amazon.com/nova/pricing/",
    "source_kind": "provider_live",
    "confidence": "verified",
    "notes": "amazon.nova-micro-v1:0. US East, on-demand Standard tier."
  },
  {
    "provider": "amazon",
    "model_id": "nova-micro",
    "variation": "output",
    "unit": "usd_per_mtok",
    "price_usd": 0.14,
    "effective_from": "2024-12-03",
    "effective_to": null,
    "last_validated_at": "2026-06-17",
    "source_url": "https://aws.amazon.com/nova/pricing/",
    "source_kind": "provider_live",
    "confidence": "verified"
  },
  {
    "provider": "amazon",
    "model_id": "nova-lite",
    "variation": "input",
    "unit": "usd_per_mtok",
    "price_usd": 0.06,
    "effective_from": "2024-12-03",
    "effective_to": null,
    "last_validated_at": "2026-06-17",
    "source_url": "https://aws.amazon.com/nova/pricing/",
    "source_kind": "provider_live",
    "confidence": "verified",
    "notes": "amazon.nova-lite-v1:0."
  },
  {
    "provider": "amazon",
    "model_id": "nova-lite",
    "variation": "output",
    "unit": "usd_per_mtok",
    "price_usd": 0.24,
    "effective_from": "2024-12-03",
    "effective_to": null,
    "last_validated_at": "2026-06-17",
    "source_url": "https://aws.amazon.com/nova/pricing/",
    "source_kind": "provider_live",
    "confidence": "verified"
  },
  {
    "provider": "amazon",
    "model_id": "nova-pro",
    "variation": "input",
    "unit": "usd_per_mtok",
    "price_usd": 0.8,
    "effective_from": "2024-12-03",
    "effective_to": null,
    "last_validated_at": "2026-06-17",
    "source_url": "https://aws.amazon.com/nova/pricing/",
    "source_kind": "provider_live",
    "confidence": "verified",
    "notes": "amazon.nova-pro-v1:0."
  },
  {
    "provider": "amazon",
    "model_id": "nova-pro",
    "variation": "output",
    "unit": "usd_per_mtok",
    "price_usd": 3.2,
    "effective_from": "2024-12-03",
    "effective_to": null,
    "last_validated_at": "2026-06-17",
    "source_url": "https://aws.amazon.com/nova/pricing/",
    "source_kind": "provider_live",
    "confidence": "verified"
  },
  {
    "provider": "amazon",
    "model_id": "nova-premier",
    "variation": "input",
    "unit": "usd_per_mtok",
    "price_usd": 2.5,
    "effective_from": "2025-04-30",
    "effective_to": null,
    "last_validated_at": "2026-06-17",
    "source_url": "https://aws.amazon.com/nova/pricing/",
    "source_kind": "provider_live",
    "confidence": "verified",
    "notes": "amazon.nova-premier-v1:0. GA 2025-04."
  },
  {
    "provider": "amazon",
    "model_id": "nova-premier",
    "variation": "output",
    "unit": "usd_per_mtok",
    "price_usd": 12.5,
    "effective_from": "2025-04-30",
    "effective_to": null,
    "last_validated_at": "2026-06-17",
    "source_url": "https://aws.amazon.com/nova/pricing/",
    "source_kind": "provider_live",
    "confidence": "verified"
  },
  {
    "provider": "amazon",
    "model_id": "nova-2-lite",
    "variation": "input",
    "unit": "usd_per_mtok",
    "price_usd": 0.3,
    "effective_from": "2025-12-02",
    "effective_to": null,
    "last_validated_at": "2026-06-17",
    "source_url": "https://aws.amazon.com/nova/pricing/",
    "source_kind": "provider_live",
    "confidence": "verified",
    "notes": "amazon.nova-2-lite-v1:0."
  },
  {
    "provider": "amazon",
    "model_id": "nova-2-lite",
    "variation": "output",
    "unit": "usd_per_mtok",
    "price_usd": 2.5,
    "effective_from": "2025-12-02",
    "effective_to": null,
    "last_validated_at": "2026-06-17",
    "source_url": "https://aws.amazon.com/nova/pricing/",
    "source_kind": "provider_live",
    "confidence": "verified"
  },
  {
    "provider": "amazon",
    "model_id": "nova-2-pro",
    "variation": "input",
    "unit": "usd_per_mtok",
    "price_usd": 1.25,
    "effective_from": "2026-06-22",
    "effective_to": "2026-06-29",
    "last_validated_at": "2026-06-22",
    "source_url": "https://aws.amazon.com/bedrock/pricing/",
    "source_kind": "provider_live",
    "confidence": "inferred",
    "notes": "[needs_review] cross-check flagged: no independent corroboration (new model, no OpenRouter match). Nova 2.0 Pro. us-east-1, on-demand (cross-region-global profile where AWS publishes one). From the AWS Bedrock Price List API."
  },
  {
    "provider": "amazon",
    "model_id": "nova-2-pro",
    "variation": "output",
    "unit": "usd_per_mtok",
    "price_usd": 10,
    "effective_from": "2026-06-22",
    "effective_to": "2026-06-29",
    "last_validated_at": "2026-06-22",
    "source_url": "https://aws.amazon.com/bedrock/pricing/",
    "source_kind": "provider_live",
    "confidence": "inferred",
    "notes": "[needs_review] cross-check flagged: no independent corroboration (new model, no OpenRouter match). Nova 2.0 Pro. us-east-1, on-demand (cross-region-global profile where AWS publishes one). From the AWS Bedrock Price List API."
  },
  {
    "provider": "amazon",
    "model_id": "nova-2-pro",
    "variation": "input",
    "unit": "usd_per_mtok",
    "price_usd": 1.25,
    "effective_from": "2026-06-29",
    "effective_to": null,
    "last_validated_at": "2026-06-29",
    "source_url": "https://aws.amazon.com/bedrock/pricing/",
    "source_kind": "provider_live",
    "confidence": "verified",
    "notes": "[provenance upgrade] first-party collector confirmed the published price; supersedes the prior inferred/provider_live record. Nova 2.0 Pro. us-east-1, on-demand (cross-region-global profile where AWS publishes one). From the AWS Bedrock Price List API."
  },
  {
    "provider": "amazon",
    "model_id": "nova-2-pro",
    "variation": "output",
    "unit": "usd_per_mtok",
    "price_usd": 10,
    "effective_from": "2026-06-29",
    "effective_to": null,
    "last_validated_at": "2026-06-29",
    "source_url": "https://aws.amazon.com/bedrock/pricing/",
    "source_kind": "provider_live",
    "confidence": "verified",
    "notes": "[provenance upgrade] first-party collector confirmed the published price; supersedes the prior inferred/provider_live record. Nova 2.0 Pro. us-east-1, on-demand (cross-region-global profile where AWS publishes one). From the AWS Bedrock Price List API."
  }
]
